{
  "type_id": "linep.v02.request",
  "schema_version": "0.1",
  "provenance": {
    "kind": "SOURCE_LITERAL",
    "source_id": "fixture:synthetic"
  },
  "payload": {
    "protocol_version": "0.2",
    "stream": {
      "request_id": "9007199254740993",
      "execution_id": "18446744073709551615",
      "output_id": 0
    },
    "profile": "chat",
    "model_id": "fixture/model",
    "payload": "{\"messages\":[{\"role\":\"user\",\"content\":\"Grüße 🌙\"}]}",
    "max_tokens": 64,
    "temperature": 0.5,
    "stream_requested": true,
    "has_options": true,
    "options": {
      "top_p": 0.8999999761581421,
      "top_k": 40,
      "repeat_penalty": 1,
      "repeat_last_n": 64,
      "seed": "18446744073709551615",
      "presence_penalty": 0,
      "frequency_penalty": 0,
      "stop_sequences": [
        "END",
        "STOP"
      ],
      "extra_options": [
        [
          "a",
          "1"
        ],
        [
          "z",
          "2"
        ]
      ]
    }
  }
}
